<?xml version="1.1" encoding="UTF-8"?>
<!--
  The word classes a shape matches against. Every class here is CLOSED: the
  language admits no new article and no new preposition, so the list is the
  whole class and stays correct. An open class is what is left when no class
  here claims the word, and a shape names that with <open/>.

  A class is data. Adding a word is an edit to this file and needs no Go.

  This file sorts ahead of every other, so its classes are indexed before the
  shapes that read them.
-->
<rules xmlns:xsi="http://www.w3.org/2001/XMLSchema-instance" xsi:noNamespaceSchemaLocation="rules.xsd" for="numbers">

  <!-- An article fills the slot "a single" needs. A shape that writes an
       article where one of these already stands spells "the a single". -->
  <class name="article" words="a an the"/>

  <!-- A determiner governs the noun after it, the way an article does. -->
  <class name="determiner" words="this that these those each every any no some
    another other which whichever either neither both several many few all
    its their our my your his her whose"/>

  <!-- A relative pronoun opens a clause. A cardinal before one stands for a
       noun rather than counting it. -->
  <class name="relative" words="that which who whom whose when where while"/>

  <!-- A unit of measure. The cardinal before one is the measurement itself
       rather than a tally of items, so cutting it destroys the fact: "every 30
       seconds" becomes "every seconds". No set changes underneath it, which is
       the whole reason the count rule exists, so a unit is never stale. -->
  <class name="unit" words="ns ms s min nanosecond nanoseconds microsecond microseconds
    millisecond milliseconds second seconds minute minutes hour hours day days
    week weeks month months year years
    bit bits byte bytes kib mib gib tib kb mb gb tb kilobyte kilobytes
    megabyte megabytes gigabyte gigabytes terabyte terabytes
    character characters line lines column columns row rows word words
    percent degree degrees pixel pixels em rem
    time times level levels version versions"/>

  <!-- A conjunction joins, and heads no noun phrase. -->
  <class name="conjunction" words="and or but so because though although if
    unless since while whereas"/>

  <!-- A preposition heads no noun phrase on its own. -->
  <class name="preposition" words="of in on at to for with from by into onto
    under over per as than through against between among about after before
    during without within across below above behind beside beyond near upon
    until toward towards along around via despite versus off out up down"/>

  <!-- An auxiliary carries the verb, so a word after a cardinal that is one of
       these makes the cardinal the subject. -->
  <class name="auxiliary" words="is are was were be been being am has have had
    does do did can could will would shall may might must should"/>

  <!-- An adverb modifies the verb, and heads no noun phrase. -->
  <class name="adverb" words="still already only never always also too here
    there now then again once twice rather quite very just even soon later
    instead however therefore"/>

  <!-- A pronoun already stands for a noun. -->
  <class name="pronoun" words="it they them we us you he him she
    something anything nothing everything"/>

  <!-- A verb form named by its ending, because the class is open and has no
       list. A gerund also spells a noun ("a string", "a setting"), so a match
       reads this as "do not decide", never as "this is a verb". -->
  <class name="verbform" suffix="ing ed"/>

  <!-- A past tense that no ending marks. The suffix class reaches the regular
       forms; these spell the same thing with a vowel change and would pass for
       nouns, which makes the cardinal before them count a verb: "what each one
       got" became "what each a single got". Every word here is a verb form
       only. A spelling that also names a thing ("set", "run", "read", "left",
       "thought") belongs in the open class, because there the cardinal really
       may be counting it. -->
  <class name="irregular" words="got gotten went gone took taken came kept
    held made gave given knew known told said wrote written chose chosen
    began begun sent meant built brought bought caught taught sought
    lost met paid sat spent stood understood wore worn won became become
    grew grown drew drawn threw thrown spoke spoken broke broken
    froze frozen rose risen"/>

  <!-- A noun is what no closed class claims and no ending marks as a verb. It
       is the open class, less the verb forms, so a term can ask for a noun
       without asking a parser. -->
  <class name="noun" open="true" except="verbform irregular number"/>

  <!-- A word that ends like a plural. A tally governs a plural noun, and a verb
       after a plural subject carries no "s": "the three shapes" is a tally,
       "the three agree" is a subject and its verb. -->
  <class name="plural" suffix="s"/>

  <!-- The cardinals the rule is about. A shape names the word it governs, so
       this class is what a shape reads to find any of them at once. -->
  <class name="cardinal" words="two three four five six seven eight
    nine ten eleven twelve dozen hundred thousand million"/>

  <!-- Any number, in digits or in words. A shape that must not care how the
       author spelled it names this class. -->
  <class name="number" digits="true" words="two three four five six seven
    eight nine ten eleven twelve thirteen fourteen fifteen sixteen seventeen
    eighteen nineteen twenty thirty forty fifty sixty seventy eighty ninety
    dozen hundred thousand million"/>

  <!-- A word that qualifies the number after it. It says nothing once the
       number goes, so a repair that drops the number drops this word too. -->
  <class name="approximation" words="about roughly around approximately
    nearly almost only just exactly precisely"/>

</rules>
