<?xml version="1.1" encoding="UTF-8"?>
<!--
  Prose the rule knows is bad and must not rewrite. A <flag> has no single
  correct replacement, so guessing one would put a wrong sentence in a comment
  the reader trusts. The finding says what is wrong and what to write instead,
  and a person makes the call.

  `say` is addressed to whoever reads the finding, so it names the repair
  rather than restating the rule.
-->
<rules xmlns:xsi="http://www.w3.org/2001/XMLSchema-instance" xsi:noNamespaceSchemaLocation="rules.xsd" for="english">

  <flag id="as-mentioned-above" phrase="as mentioned above"
        say="name the thing, not its position: an edit above this moves it">
    <test in="As mentioned above it races"/>
  </flag>
  <flag id="as-mentioned-below" phrase="as mentioned below"
        say="name the thing, not its position: an edit below this moves it">
    <test in="As mentioned below it races"/>
  </flag>
  <flag id="see-above" phrase="see above"
        say="name what to look at: a reader arriving by search has no above">
    <test in="See above for the reason"/>
  </flag>
  <flag id="see-below" phrase="see below"
        say="name what to look at: a reader arriving by search has no below">
    <test in="See below for the reason"/>
  </flag>
  <flag id="for-now" phrase="for now"
        say="say what would change it, or drop it: every comment is for now">
    <test in="For now it retries once"/>
  </flag>
  <flag id="currently" phrase="currently"
        say="a comment states what IS, so currently adds nothing">
    <test in="It currently retries once"/>
  </flag>
  <flag id="used-to" phrase="used to"
        say="say what it does; git holds what it did">
    <test in="It used to retry twice"/>
  </flag>
  <flag id="no-longer" phrase="no longer"
        say="say what it does; git holds what it did">
    <test in="It no longer retries"/>
  </flag>
  <flag id="will-be" phrase="will be"
        say="a comment describes the code that is here, not the one coming">
    <test in="This will be replaced"/>
  </flag>
  <flag id="tbd" phrase="tbd"
        say="state the value or the question; TBD ages into a lie">
    <test in="The limit is TBD"/>
  </flag>
  <flag id="obviously-wrong" phrase="obviously wrong"
        say="say what is wrong and what it should be">
    <test in="This is obviously wrong"/>
  </flag>
  <flag id="hack" phrase="hack"
        say="say what forced it, so the next reader can judge whether it still holds">
    <test in="A hack around the race"/>
  </flag>
  <flag id="for-some-reason" phrase="for some reason"
        say="find the reason or say you could not: a shrug helps nobody">
    <test in="For some reason it races"/>
  </flag>
  <flag id="magic-number" phrase="magic number"
        say="name the constant and where it comes from">
    <test in="A magic number from the spec"/>
  </flag>
  <flag id="do-not-ask" phrase="do not ask"
        say="answer it here, or the next reader pays to rediscover it">
    <test in="Do not ask why"/>
  </flag>

</rules>
