<?xml version="1.1" encoding="UTF-8"?>
<!--
  A single sentence too long for its code has no sentence end to cut at. The
  length repair then cuts at the last clause boundary that fits, and closes what
  it keeps with a period. A whole clause still reads. A cut between words of a
  clause does not.

  Each test is one over-long comment, placed above one line of code. out= is
  the prose the repair keeps.
-->
<rules xmlns:xsi="http://www.w3.org/2001/XMLSchema-instance" xsi:noNamespaceSchemaLocation="rules.xsd" for="comment-clauses">

  <!-- A mark ends a clause when a space follows it. A dash also needs a space before it. -->
  <class name="boundary" words=": ; , --"/>

  <!--
    A tail opener starts a part the cut can drop: a purpose, a reason or an aside.
    The claim before it stays true. A condition such as "when" or "if" is not here:
    a cut before it changes the claim.
  -->
  <class name="tail" words="so because ("/>

  <!-- The last boundary that fits wins, so the cut keeps as much as the budget allows. -->
  <test in="The pipes are ours, not StdoutPipe's: exec closes those at Wait, and this process must outlive that to bound a reader itself. See drainGrace."
        out="The pipes are ours, not StdoutPipe's: exec closes those at Wait."/>
  <test in="Wait reports only once both spools have seen their end: reap closes the relays after the grace, releasing a stream a grandchild still holds open."
        out="Wait reports only once both spools have seen their end: reap closes the relays after the grace."/>
  <test in="A linked worktree's .git is a file naming a gitdir under the parent's .git/worktrees; its refs and config live in the commondir beside it."
        out="A linked worktree's .git is a file naming a gitdir under the parent's .git/worktrees."/>
  <test in="The fork's go command starts each tool as itself -- the path of this executable would start the whole pipeline instead of the tool it named."
        out="The fork's go command starts each tool as itself."/>

  <!-- A whole sentence that fits at the budget's width stays whole, whatever the wrap width. -->
  <test in="forkBranchScript is the fork's own answer to which commit an org submodule stands at. The gitlink beside it is the fallback for a build that cannot reach the remote."
        out="forkBranchScript is the fork's own answer to which commit an org submodule stands at."/>

  <!-- A boundary inside brackets or a code span is not a cut: it would leave the pair open. -->
  <test in="The step reads the file (the one named in go.mod, not the copy), and then it writes the answer back to the same place it came from, every time."
        out="The step reads the file (the one named in go.mod, not the copy)."/>

</rules>
