<?xml version="1.1" encoding="UTF-8"?>
<!--
  The closed word classes the sentence parser reads. The tagger names a part of
  speech. These classes say what role a word plays in a clause, which a Penn
  tag does not: IN is a preposition and a subordinator alike.
-->
<rules xmlns:xsi="http://www.w3.org/2001/XMLSchema-instance" xsi:noNamespaceSchemaLocation="rules.xsd" for="syntax">

  <!-- A subordinator opens a dependent clause. -->
  <class name="subordinator" words="because although though unless whereas
    while when whenever where wherever if once until before after since
    whether"/>

  <!-- A coordinator joins equals: two clauses, or two verb groups that share
       a subject. -->
  <class name="coordinator" words="and but or so yet nor"/>

  <!-- A relative word opens a clause that describes the noun before it. -->
  <class name="relative" words="which who whom whose that"/>

  <!-- A determiner the parser accepts ahead of a numeral. A quantifier such as
       each or any is left out, because "any two nodes" names a pair. -->
  <class name="definite" words="the these those this that its their our your
    his her my"/>

  <!-- A count spelled as a word. The tagger marks "first" and "dozens" as
       numbers too, and neither is a count a reader can drop. -->
  <class name="number-word" words="one two three four five six seven eight nine
    ten eleven twelve thirteen fourteen fifteen sixteen seventeen eighteen
    nineteen twenty thirty forty fifty sixty seventy eighty ninety hundred"/>

  <!-- A pronoun the tagger reads as a noun. Like a determiner, it cannot follow a plural noun. -->
  <class name="indefinite" words="nothing everything something anything nobody
    everybody somebody anybody everyone someone anyone"/>

  <!-- An object pronoun follows a verb or a preposition, never a noun. -->
  <class name="object" words="it them him her us me"/>

  <!-- A subject pronoun that takes the -s form of a verb: "it gains". -->
  <class name="singular-subject" words="it he she"/>

  <!-- A determiner that opens a noun phrase. A past form after it describes the noun. "that" is absent, because it also opens a relative clause. -->
  <class name="determiner" words="a an the each every this these those no any some"/>

  <!-- A place word that follows the noun it places: "the case above". -->
  <class name="postposed" words="above below here there"/>

  <!-- An adjective the tagger reads as a past participle: "cannot be solid". -->
  <class name="adjective" words="solid liquid rigid"/>

  <!-- A noun that names a person takes they rather than it. -->
  <class name="person" words="user users person people caller callers author
    authors owner owners reader readers writer writers reviewer reviewers
    maintainer maintainers operator operators developer developers contributor
    contributors engineer engineers human humans agent agents"/>

</rules>
