<?xml version="1.1" encoding="UTF-8"?>
<!--
  A cardinal tallying a set. The tally is true until somebody changes the set,
  so the repair says what is there and lets the reader count.

  Only a tally is here. "one", "once", "first" and "zero" count no set that can
  grow, so the rule does not report them and nothing here rewrites them.
-->
<rules xmlns:xsi="http://www.w3.org/2001/XMLSchema-instance" xsi:noNamespaceSchemaLocation="rules.xsd" for="numbers">

  <!-- The cardinal stands in for the noun. "both" fits as a subject and as an
       object, where "they" and "them" each fit only one. -->
  <rewrite id="the-two" from="the two" to="both">
    <test in="The two agree" out="Both agree"/>
    <test in="It keeps the two apart" out="It keeps both apart"/>
  </rewrite>

  <!-- A term names a word CLASS, which a regexp has no way to say. The classes
       are in english-classes.xml, and {name} in the replacement writes back
       what the term of that name matched.

       Each shape with a noun goes before the same shape without one. The scan
       tries entries in order at each word, so the bare shape would otherwise
       claim "the three shapes" and write "all of them shapes". The noun must
       be plural: "agree" in "all three agree" is the verb. -->
  <rephrase id="the-other-cardinal-noun" match="the other {cardinal:c} {noun+plural:n}" to="the other {n}">
    <test in="The other two files run a loop" out="The other files run a loop"/>
  </rephrase>
  <rephrase id="the-other-cardinal" match="the other {cardinal:c}" to="the others">
    <test in="The other two run a loop" out="The others run a loop"/>
  </rephrase>
  <rephrase id="all-cardinal-noun" match="all {cardinal:c} {noun+plural:n}" to="all {n}">
    <test in="All three files agree" out="All files agree"/>
  </rephrase>
  <rephrase id="all-cardinal" match="all {cardinal:c}" to="all of them">
    <test in="All three agree" out="All of them agree"/>
  </rephrase>
  <rephrase id="the-cardinal-noun" match="the {cardinal:c} {noun+plural:n}" to="the {n}">
    <test in="It names the three shapes GitHub uses" out="It names the shapes GitHub uses"/>
  </rephrase>
  <!-- "the three" points back at a set, and nothing on the line says the set
       holds only three. "those" keeps the reference and claims no "all". -->
  <rephrase id="the-cardinal" match="the {cardinal:c}" to="those">
    <test in="It reads the three" out="It reads those"/>
    <test in="The three agree" out="Those agree"/>
    <test in="The three that fail stop the run" out="Those that fail stop the run"/>
  </rephrase>
  <!-- "those" already points back at the set, so the cardinal after it only
       claims a size. -->
  <rephrase id="those-cardinal" match="those {cardinal:c}" to="those">
    <test in="It would miss those two" out="It would miss those"/>
    <test in="Those three agree" out="Those agree"/>
  </rephrase>

  <!-- A preposition after the cardinal means the cardinal is the noun phrase
       itself: "two of them" names a part of a group. Cutting the cardinal
       leaves "GET of them", so the part is said in words instead. -->
  <rephrase id="a-cardinal-governing-no-noun" match="{cardinal:c} of" to="some of">
    <test in="Batch GET two of them" out="Batch GET some of them"/>
  </rephrase>

  <!-- A repeat interval goes stale when someone tunes the knob. "few" keeps the
       unit, so the reader still knows the scale. -->
  <rephrase id="every-interval-goes-vague" match="every {number} {unit+plural:u}" to="every few {u}">
    <test in="It polls every 15 minutes" out="It polls every few minutes"/>
    <test in="Every 30 seconds it retries" out="Every few seconds it retries"/>
    <test in="It runs every two hours" out="It runs every few hours"/>
    <test in="It runs every 1.5 hours" out="It runs every 1.5 hours"/>
  </rephrase>

  <!-- A plural tally: the noun carries the meaning and the number goes.

       A unit is not a tally. "waits two minutes" says how long, and dropping
       the cardinal leaves "waits minutes", which states nothing. The unit class
       claims those words, so the noun term below never matches one. -->
  <rephrase id="plural-tally-drops-its-count" match="{cardinal:c} {noun:n}" to="{n}">
    <test in="Two goroutines contend" out="Goroutines contend"/>
    <test in="It waits two minutes" out="It waits two minutes"/>
    <test in="It reads 260 characters" out="It reads 260 characters"/>
  </rephrase>

</rules>
